posted_by,talk_about,tweet_id,description,created_at,location,tweets_per_user,sarcasm,timezone,text,screen_name,disease,coordinate,query,user_id
individual,himself,7.197521498574766e+17,Creator of To Live & Date in LA: Blog/Series chronicling life as a single gal in LA https://t.co/uqWiW0rOfR  Shop To Live & Date in LA https://t.co/XVZSQvHKcP,2016-04-12 05:00:59,Instagram: @awkwardgirlla,13.0,,Pacific Time (US & Canada),"But this day, I was beyond determined. I did it. I freaking ran. I had to stop intermittently bc my asthma was going insane, but...",AwkwardGirlLA,Asthma,None,asthma,493642020.0
individual,himself,7.197818630118482e+17,did that piercing fucking hurt,2016-04-12 06:59:03,he/him,3.0,,Eastern Time (US & Canada),i just shook my phone instead of my inhaler,hoemoerotic,Asthma,,Inhaler,3145934230.0
individual,himself,7.197858032079462e+17,,2016-04-12 07:14:43,,218.0,,Adelaide,3 myths in relation with high nebulizer terminal since residential adjectival phrase: vFqF,LambertsOswald,Asthma,None,Nebulizer,1240747934.0
individual,himself,7.198821824460268e+17,Small girl. Big dreams. Bigger God. Psalms. Milk & Matcha. Snapchat instagram jenveni,2016-04-12 13:37:41,"Music, Art & Wheels Est. 1996",1.0,,Pacific Time (US & Canada),"@JanOlabarrieta asthma bruh, asthma since birth. Derma and respiratory bruh i cri",jenaveni,Asthma,None,asthma,445927967.0
individual,himself,7.199188794101637e+17,~ my penguin; my soulmate. 29/03/16. Woosh ~ my bitch.,2016-04-12 16:03:30,midnight moon,4.0,,None,@wooshinxmm DOESNT ALWAYS WORK WITH ACUTE ASTHMA WYS BITCH,wonhoxmm,Asthma,None,asthma,4817726740.0
individual,himself,7.199396339755336e+17,"broken phone charger & the hacker known as 4chan // caiti, 17, pan - [she/her or they/them] // @ililnevar is the tear in my heart",2016-04-12 17:25:59,run away with me?,1.0,,Eastern Time (US & Canada),Woof I feel like I'm having an asthma attack from caring a box to the car,bluexlips,Asthma,None,asthma,547070994.0
individual,himself,7.199547724475064e+17,Storm In The Sea,2016-04-12 18:26:08,Jamaica,1.0,,Central Time (US & Canada),"Found an excuse not to go to school -Rain is falling, my asthma is being a bitch from the other day. Cyah bodda wid another asthma attack-",SincerelyWizana,Asthma,None,asthma,162607250.0
individual,himself,7.199636436186726e+17,Single and enjoying it,2016-04-12 19:01:23,"mukilteo, WA",2.0,,,"Still in major pain, but I'll survive since I'm so driven. Cough is lingering and my inhaler just arrived. Went to the doctor's office to g...",cabalquinto46,Asthma,,Inhaler,1633712616.0
individual,himself,7.19985278165848e+17,"I love my life, too young to care ..my favorite person my life nd my everything is @elissakh , studying finance",2016-04-12 20:27:21,tunisie,1.0,,Greenland,"@elissakh I was taking oxygen bcz of the asthma  , my mood is down then they told me u recorded song num 4 ^_^",MerryCherif,Asthma,None,asthma,180604988.0
individual,himself,7.199858913563566e+17,25. Loan Officer. History degree. Cleveland sports fan. LaFamilia,2016-04-12 20:29:47,kettering,1.0,,None,Trouble breathing :(. Yay asthma.,Cjo4508,Asthma,None,asthma,2349438768.0
individual,himself,7.200078156626903e+17,18|Arizona Hip-Hop Artist and Poet|SNAPCHAT bradison_cutler|https://t.co/g2XIzmEyjc,2016-04-12 21:56:55,A Coffee Shop,1.0,,Pacific Time (US & Canada),Almost had an asthma attack after those dabs lmfao I'm so scrub,Bradison_,Asthma,None,asthma,3092515152.0
individual,himself,7.200147024372244e+17,professional dreamer // ptx & ariana grande stan,2016-04-12 22:24:16,NZ | she/her,1.0,,Pacific Time (US & Canada),"I can't breathe, my heart is racing and I don't have my inhaler with me ajsjejsjsj",pentariix,Asthma,,Inhaler,3368879119.0
individual,himself,7.20023407430017e+17,Bug Princess - Closet Baby Goth - Artist - Nerd,2016-04-12 22:58:52,Canada,1.0,,Mountain Time (US & Canada),I managed to survive the ordeal and I took a puff of my inhaler in case asthma was contributing but ohmigod I'm on allergy meds for a reason,Zomrombone,Asthma,None,asthma,342162775.0
individual,himself,7.200285231975055e+17,P. Sherman 42 Wallaby Way Sydney #FutureHive insta: theregophee/makeupbyphee_ | Snap: pheelovepink,2016-04-12 23:19:12,kancity,8.0,,,I need my inhaler bro I can't,ThereGoPhee,Asthma,,Inhaler,235781141.0
individual,himself,7.200312887622205e+17,,2016-04-12 23:30:11,,1.0,,None,made me realise how unfit i am nearly had about 5 asthma attacks along the way @daniellehawkk,alexandraparry1,Asthma,None,asthma,1035441120.0
individual,himself,7.200322321408901e+17,"BIOCHEMIST, Clinical Researcher, PERMANENT TeleOncoMedSurg (TOMS) #RN #BSN, @BarbizonModels & @QueensUniv grad. PROFESSIONAL walking billboard & CHEERLEADER...",2016-04-12 23:33:56,on call /Intl. #MadSchool,3.0,,Quito,so anyways ...back to my acute asthma monologues ooo #ASTHMA here it is in a sentence Shake that asthma OOOOH  https://t.co/V1NOHLncbx,DrCrockpot,Asthma,None,asthma,206955948.0
individual,himself,7.200333918364631e+17,the more moist the better,2016-04-12 23:38:32,inside your brain,1.0,,Eastern Time (US & Canada),today was the first day I ran after finding out I have asthma and I DIDNT DIE.,shroomalyn,Asthma,None,asthma,1070166307.0
individual,himself,7.200345425816535e+17,The world is a book and those who do not travel read only one page. - St Augustine,2016-04-12 23:43:07,"New Jersey, USA",1.0,,None,Feeling like a  right now having an asthma attack in the middle of an awards dinner. #allergies are in full swing right now,tblack321,Asthma,None,asthma,462282672.0
individual,himself,7.200657403055268e+17,"so long as there is life coursing through my veins, that is reason enough for me to pursue my purpose -EMDUNC #wonderwomanmentality",2016-04-13 01:47:05,NIU,2.0,,Central Time (US & Canada),I've had to use my inhaler more times in the past 6 months than in the past 6 years. This weather needs to get better ASAP.,elocin_26,Asthma,,Inhaler,310048035.0
individual,himself,7.200708797204234e+17,King's Queen since October of 2014,2016-04-13 02:07:30,SC: nicolee.babyy,1.0,,Eastern Time (US & Canada),@Kiing_Ch3vy_ I got my asthma pump,Melanin_Poppinn,Asthma,None,asthma,396802080.0
individual,himself,7.200711522537144e+17,19* NOT 12//:://///// welcome to my world,2016-04-13 02:08:35,"Miami Beach, FL",1.0,,None,"My eye is swollen right now , I'm getting a cold , my asthma be acting up fuck my immune system",RobertSmunoz,Asthma,None,asthma,3246283089.0
individual,himself,7.200890662350152e+17,Christ,2016-04-13 03:19:46,STATES,1.0,,Central Time (US & Canada),I couldn't even finish the video cause my asthma already acting up and I got better things to do smh I want that minute back I wasted tho,itsemike,Asthma,None,asthma,523495112.0
individual,himself,7.200994763676549e+17,"Real Eyes, Realize, Real Lies. #BSU17",2016-04-13 04:01:08,The District,2.0,,Central Time (US & Canada),I can't chase these hoes i got asthma https://t.co/jYQpYwoBtn,StunnaShowtime,Asthma,None,asthma,145043463.0
individual,himself,7.201003976003707e+17,Sheeeeeeeeeshh  17    IG: brandy.bbear,2016-04-13 04:04:48,"Nova Scotia, Canada",2.0,,None,"Sheesh, the asthma struggle is real tonight",BB_Brandice,Asthma,None,asthma,2486021946.0
individual,himself,7.201177873022239e+17,Lifeguard. I edit videos sometimes. BioMed major at TAMUK. Instagram/Snapchat @TheWyattPaschal - Xbox Live: SirJibbly Eh  https://t.co/yUL86rld68,2016-04-13 05:13:54,"Corpus Christi, TX",1.0,,Central Time (US & Canada),Asthma sucks.,TheWyattPaschal,Asthma,None,asthma,539454596.0
individual,himself,7.20122255175512e+17,17 and always happy,2016-04-13 05:31:39,,1.0,,Arizona,it's times like this that I wish I knew where my inhaler is,gnarleynina,Asthma,,Inhaler,2533690057.0
individual,himself,7.201563062298829e+17,pro-football / anti-idiots.,2016-04-13 07:46:57,Whitehawk,1.0,,Amsterdam,@Luke1972 I certainly will not be having fun. I will be having an asthma attack.,HawksUltras,Asthma,None,asthma,447256170.0
individual,himself,7.201577539902054e+17,big forehead big dreams big money,2016-04-13 07:52:43,@ van's,1.0,,Central Time (US & Canada),asthma is annoying asf like since when is it okay for lungs to not do their job,semsthetic,Asthma,None,asthma,1393085041.0
individual,himself,7.201785811004744e+17,Dominican.,2016-04-13 09:15:28,,1.0,,None,"@getoffmyshit_ LMAOO I woke up 2 hrs ago, I need a nebulizer LMAO",em_xx33,Asthma,None,Nebulizer,2841271404.0
individual,himself,7.201849613539164e+17,,2016-04-13 09:40:49,@zelirium,1.0,,Beijing,i have a skin asthma,zycophant,Asthma,None,asthma,2814704071.0
individual,himself,7.20199101036544e+17,Leoponess. Cornea Recipient. Motlokwa  #EyeHealth #GiftOfSight #DonateLife #Lupus #EyeCare #ChangeLives. Reads @forbesafrica. Loves #Putin,2016-04-13 10:37:00,ZA,2.0,,None,@QncSly I take asthma meds cause of lung troubles and breathing at times is a hustle.,Molemole_S,Asthma,None,asthma,1705572541.0
individual,himself,7.202149597335429e+17,a weeb https://t.co/1xHDp20f01,2016-04-13 11:40:02,Bristol / Brighton,3.0,,Amsterdam,I find it unfair because asthma is a disease I have to live with it my whole life.,VongolaLDR,Asthma,None,asthma,968480106.0
individual,himself,7.202591961014682e+17,ONE OF A KIND TYPE GURL NOT LIKE OTHERS.......,2016-04-13 14:35:48,,1.0,,None,Asthma Sucks Ass,MZ_BEAUTIFULLUV,Asthma,None,asthma,339342542.0
individual,himself,7.202722801572045e+17,"Love something & love it deeply. (Andrew Scott) ~ Sherlock, Johnlock, Zimbits, Hamilton, Martin Freeman, Benedict Cumberbatch Maker/Handler of The Cro-BabiesTM",2016-04-13 15:27:48,"Fly-over states, USA",1.0,,Central Time (US & Canada),#Sherlock leading men have THE MOST BEAUTIFUL NAPES of all time. That is all. Carry on. I'll be looking for my inhaler &amp; trying to breathe.,BenBatched,Asthma,,Inhaler,572070922.0
individual,himself,7.202737056670638e+17,If you can't grind with the big dogs then keep off the rail.,2016-04-13 15:33:28,717-412,1.0,,Eastern Time (US & Canada),*uses inhaler *  *goes out for a smoke*,Ben_JAMMIN29,Asthma,,Inhaler,555588399.0
individual,himself,7.20281692749992e+17,"hello i'm bekkie, i do the draws and i like fictional boys very much ENG/CYM",2016-04-13 16:05:12,,2.0,,London,the good news is my lungs are 100% healthy as of right now and it isn't asthma giving me breathing problems \O/ !!!,beksdraws,Asthma,None,asthma,2539740401.0
individual,himself,7.202845156970824e+17,"Tweeting a 140 I.Q. or less...more or less.   Please Note: This is my personal account - not associated with porn, spas and wholesale pool supplies. :oP",2016-04-13 16:16:25,"Taos, New Mexico",1.0,,Mountain Time (US & Canada),#Bipolar News: Increased Incidence of Comorbid Bipolar Disorder and Asthma - Psychiatry Advisor https://t.co/w7MPvIIRa6,BipolarSpa,Asthma,None,asthma,77398204.0
individual,himself,7.203042461936968e+17,God Hates Us All,2016-04-13 17:34:49,"Elkhart, In.",7.0,,Eastern Time (US & Canada),@JustTonci I use my inhaler about 10 times a day and the nebulizer twice. I really need to see a doc but....no insurance. Life story.,GiaMarie68,Asthma,,Inhaler,22753684.0
individual,himself,7.203220076577505e+17,Don't hate me cuz you ain't me  Follow me on Instagram: @gabby41varado WPU '19,2016-04-13 18:45:24,,1.0,,Eastern Time (US & Canada),I hate when I cough I sound like an old man who has been smoking cigarettes for 85 years... #asthma,gabby41varado,Asthma,None,asthma,2767459253.0
individual,himself,7.203261525109473e+17,lets get it,2016-04-13 19:01:52,"Miami, Flo-rida",3.0,,Eastern Time (US & Canada),@Hxkcktivist if I didn't have asthma the yacoobs would be on lock down g shit,wasif_3hunna,Asthma,None,asthma,2814063678.0
individual,himself,7.203404049822638e+17,This life's been a crazy awesome skate/snowboard ride so far. Oh and I'm 2ft42in which makes me 1 of the taller minions(YVR) #DeafPride #Canucks,2016-04-13 19:58:30,Los Angeles/YVR,3.0,,Pacific Time (US & Canada),"I have my emergency inhaler on me, of course, but I didn't think missing one tiny tablet was gonna have such an impact.",LaMerenguera,Asthma,,Inhaler,42305146.0
individual,himself,7.20400502819799e+17,I will dishonor your brand  https://t.co/30oKJPH01V,2016-04-13 23:57:18,A moist place,5.0,,Central America,Hahaha I found my inhaler lets see if it fits,Moist_ebooks,Asthma,,Inhaler,1465639268.0
individual,himself,7.204015247870607e+17,"Southgate, EMU'20",2016-04-14 00:01:22,"Michigan, USA",1.0,,Eastern Time (US & Canada),I either can't breathe or use my inhaler and can't stop shaking for the rest of the night,sam_darrell_11,Asthma,,Inhaler,161106322.0
individual,himself,7.204044822410936e+17,"I like to slit throats and drink blood, fresh from the carotid artery.",2016-04-14 00:13:07,,2.0,,None,I think I need a nebulizer,thivyasri16,Asthma,None,Nebulizer,
individual,himself,7.204085572381368e+17,g o t h l u v ; 18; jfdtv,2016-04-14 00:29:19,,1.0,,Eastern Time (US & Canada),My laugh is like I'm literally dying and gasping for air and everybody laughs at it but that's cause I have asthma,brendaoyervides,Asthma,None,asthma,579425358.0
individual,himself,7.20479250558632e+17,an alternate dimension where my tweets are good,2016-04-14 05:10:13,"Hamilton, Ontario",1.0,,None,Man my asthma only ever played guys who were way better than Marco Polo are just that.,mikelradar,Asthma,None,asthma,3351331169.0
individual,himself,7.204876371953418e+17,I was born via surrogate to Ianto Jones and Jack Harkness. I have an older sister named Sam. I'm training to be a part of the Baltimore PD #MVRP #AgeVaries,2016-04-14 05:43:33,Police Academy,2.0,,Central Time (US & Canada),@IKnowGay I was really sick as a kid... Asthma and allergies didn't help anything... Went through a few surgeries... I hate the scars...--,DamonAlecHJ,Asthma,None,asthma,831981344.0
individual,himself,7.204917616389693e+17,,2016-04-14 05:59:56,IG/Snap Killakienshly,1.0,,Pacific Time (US & Canada),I have asthma I can't be chasing these hoes,KillaKienshly,Asthma,None,asthma,315005439.0
individual,himself,7.20503720291799e+17,bmf@bemyfriend.us // dallas' best dj // @thepyrexpirates,2016-04-14 06:47:27,3rd coast,1.0,,Central Time (US & Canada),@zxchburns that shit gave me asthma,WYBMF,Asthma,None,asthma,25260741.0
individual,himself,7.205092505906217e+17,You're just running through the crowd of people chasing after you and no one knows what's going on.,2016-04-14 07:09:26,Hyde Park,2.0,,Amsterdam,breath in breath out inhaler breath in breath out inhaler is it almost 10 am   I dont like this very much rn,poshsoapbox,Asthma,,Inhaler,1301326267.0
individual,himself,7.205388129218519e+17,If Young Metro didn't trust me I wouldn't be here. IG: _passthechicken / SC: aqricoo #FAMU19,2016-04-14 09:06:54,262 850,1.0,,Central Time (US & Canada),Hate my asthma &lt;,_passthechicken,Asthma,None,asthma,606783093.0
individual,himself,7.205508102501212e+17,sometimes a singer. sometimes a dancer. sometimes a leader. sometimes a musician. always a writer | DPS x UST AB | God's princess,2016-04-14 09:54:35,ig: @smilefromu,1.0,,Pacific Time (US & Canada),Can't workout bc the heat loves my lungs and they made a baby named Asthma.,margretperth,Asthma,None,asthma,1280533314.0
individual,himself,7.205744475859927e+17,Media Makeup//York College,2016-04-14 11:28:30,,1.0,,None,Pretty sure either my dodgy heart or an asthma attack will take me before my driving test today,Paigeyybum,Asthma,None,asthma,912128444.0
individual,himself,7.205751507149824e+17,"Free Spirit , With A Wild Heart",2016-04-14 11:31:18,Allahu Akbar,1.0,,Central Time (US & Canada),"Definitely gonna have to stash my asthma pump in my purses , my car , everywhere",__SincerelyJ,Asthma,None,asthma,1289953428.0
individual,himself,7.206220643699302e+17,i love my pets!!,2016-04-14 14:37:43,"Port Angeles, WA",1.0,,None,@arianasvibe Asthma,wizclique,Asthma,None,asthma,3187311738.0
individual,himself,7.206522487081697e+17,i love me but who is me,2016-04-14 16:37:39,she/her,3.0,,Central Time (US & Canada),I might have asthma GREAT,peenypeenpeen,Asthma,None,asthma,380591470.0
individual,himself,7.206782569497682e+17,"Cro-magnon man, I make fire.",2016-04-14 18:21:00,"Los Angeles, CA",1.0,,Pacific Time (US & Canada),"Every time I breath on a track, I asthma attack it https://t.co/O97cCJAcm2",ShawnyOcho,Asthma,None,asthma,3891471192.0
individual,himself,7.206964007035372e+17,"Writer/Poetry  Old Soul  Major, Sociology  Anime Geek  CA to FL   insta: yourapizzashit",2016-04-14 19:33:06,"Florida, USA",1.0,,None,"I find it crazy how @fucktyler has asthma, yet always has so much fucking energy to do the craziest shit all the time. Lmao, i heart emoji u",yourapizzashit_,Asthma,None,asthma,
individual,himself,7.207455801928827e+17,powerpuff squadTM,2016-04-14 22:48:31,los angeles,1.0,,Arizona,I'm having a damn asthma attack,handsonseI,Asthma,None,asthma,2697054487.0
individual,himself,7.207515532131082e+17,Stay slime. Be rad at all times. Breathe peace. Be kind.,2016-04-14 23:12:15,,1.0,,None,"hokay so today I got a shot of steroids,sucked on a nebulizer, Xrayed, given an inhaler, antibiotics, antiallergens and antidepressants. #",ElliotIanRoss,Asthma,None,Nebulizer,561738607.0
individual,himself,7.207686135573545e+17,"My life consists of doing what they told me I'd never be able to do. Classics Colorguard '14, '15, '16. RBCG '14.",2016-04-15 00:20:03,"Royersford, PA",1.0,,Quito,Wow my allergies are on fleek. I'm glad I didn't get to the asthma allergy doctor to make sure this was under control...,Rachael_Noone95,Asthma,None,asthma,337824778.0
individual,himself,7.207720991161262e+17,,2016-04-15 00:33:54,,1.0,,None,asthma sucks https://t.co/J4iYDf06CE,26Aprilyannie,Asthma,None,asthma,4493005633.0
individual,himself,7.207771236534026e+17,"now let's be real, I feel just like a child. man, someone could be taking all my toys. || holy shit...fuck. || infj || the GayestTM",2016-04-15 00:53:52,1732,1.0,,Alaska,@awayinmyarms someone needs the asthma device spoiler alert it's me,mishecollins,Asthma,None,asthma,230559340.0
individual,himself,7.207875385003254e+17,BOOK SCRILL VIA SCRILLERDEADEM@GMAIL.COM//GMOMGMT@GMAIL.COM | #GOT #MORE #GATOR #THAN #YOUR #DADDY: THE MIXTAPE COMING SOON,2016-04-15 01:35:15,CINCINNATI(K),1.0,,Arizona,finna hit tha hospital after I hit all my licks..cus my asthma on 10000000 but I https://t.co/pbWUnDBskF,SCRILLIARD,Asthma,None,asthma,548877129.0
individual,himself,7.208017175503258e+17,I need twitter to follow the news.,2016-04-15 02:31:35,MNL,1.0,,None,I think I will get an asthma attack just walking in this heat.,QuinaBaterna,Asthma,None,asthma,2980042645.0
individual,himself,7.20820372585599e+17,so what's the plan?,2016-04-15 03:45:43,los angeles,1.0,,Pacific Time (US & Canada),Sometimes when I run I feel like my lungs are gonna collapse which is pretty worrying considering idk if I still have asthma or not,ChloeBeaaar,Asthma,None,asthma,128107050.0
individual,himself,7.20822178078462e+17,it's like that. #NSFW Brains Behind Bourbon Ball and Arts and Crafts and Cocktails Crunk and comedy,2016-04-15 03:52:54,Out and About,2.0,,Eastern Time (US & Canada),Today is not a good day. Started with an asthma attack and ended with a heart break,ByeCorn,Asthma,None,asthma,180524193.0
individual,himself,7.208260397739991e+17,I came in like a sausage roll.,2016-04-15 04:08:14,Sunny Scotland,1.0,,London,Asthma attacks are just great at 5 in the fucking morning,_Socco,Asthma,None,asthma,552045910.0
individual,himself,7.208425464992973e+17,BENEVOLENCE.   cameron k will always be a soul to remember 8/17/15,2016-04-15 05:13:50,"Texas, USA",1.0,,Central Time (US & Canada),I was just putting on some mascara and I started wheezing bc of my asthma,bl_marie7,Asthma,None,asthma,339250311.0
individual,himself,7.208545587301007e+17,23|Aries|Nurse Assistant|SoCalLetlive.,2016-04-15 06:01:34,Fantasyland,2.0,,Pacific Time (US & Canada),I hate spring. My asthma and allergies hit me the worse.,MonikkaMilani,Asthma,None,asthma,66066037.0
individual,himself,7.208976233858785e+17,I write things. I rant a bit. I support a few different causes. Chronic pain spoonie.  Columnist for @HertsEssexObser & @EastMagazines Mental Health campaigner.,2016-04-15 08:52:41,Bishop's Stortford,2.0,,London,@notwaving ...months with asthma problems just before my joints deteriorated further.,Osborneosaurus,Asthma,None,asthma,98679111.0
individual,himself,7.209203258573742e+17,,2016-04-15 10:22:54,the bin,1.0,,London,I'm having like.  asthma problems today and I m shaky :/,krystyeol,Asthma,None,asthma,2522431614.0
individual,himself,7.209292974484644e+17,"http://t.co/3apOHyGI;co-author-- Asthma Allergies Children: a parent's guide w/ pediatric allergists, Dr. Larry Chiaramonte and Dr. Paul Ehrlich.",2016-04-15 10:58:33,"Brooklyn, NY",1.0,,Central Time (US & Canada),On the road to allergy prophylaxis #allergy #foodallergy ~asthma https://t.co/nnmAX5GPAb,AACMaven,Asthma,None,asthma,22981419.0
individual,himself,7.209410316512788e+17,#BhagatSingh 4 Patriotism #MahatmaGandhi 4 Independence & Values #AtalBihariVajpayee 4 Statesmenship #Abrahamlincoln 4 Persistence that's me,2016-04-15 11:45:11,India,1.0,,New Delhi,My asthma has gone completely on just day one  Wow thats an achievement #OddevenDobara,Sundeep123,Asthma,None,asthma,74985668.0
individual,himself,7.209982612937564e+17,hi i'm montse and i like nature a lot  // !,2016-04-15 15:32:35,INTP // perth,1.0,,None,I got a panic induced asthma attack cause someone came to visit my town in animal crossing,teacupmanga,Asthma,None,asthma,4470569354.0
individual,himself,7.210125162986004e+17,sc joeaziz7,2016-04-15 16:29:14,wall street,1.0,,Casablanca,"@DaisyPathy_ nice one double figures daisy, hope you recovered from your asthma attack earlier,  see you soon burg xx",joeaziz15,Asthma,None,asthma,615257814.0
individual,himself,7.210154368554148e+17,@YoloMonday #YoloMania / #UniWave #MUFC Snapchat: BeatsByStan,2016-04-15 16:40:50,Lewisham Boro to Leicester DMU,1.0,,Casablanca,Doctor said I've outgrown my asthma but it will only effect me when I have a cold,BeatsByStan,Asthma,None,asthma,234021459.0
individual,himself,7.210322779254579e+17,"Academic, triathlete, duathlete, occasional bike racer. Escaped from Alcatraz.",2016-04-15 17:47:45,Kings Heath,1.0,,None,@Rach_2_Oh I get this too after races... https://t.co/TBM9xJWk0K I'm resisting to go to the doc because it doesn't bother me that much after,XFmGirl,Asthma,None,Exercise-induced asthma,171439629.0
individual,himself,7.210349000951153e+17,JUST TRY TO LOVE MYSELF FIRST  #xunimas,2016-04-15 17:58:11,MALAYSIA,4.0,,Kuala Lumpur,fever n asthma pleaze go away   I have lot work todo after this,AMYASZELI,Asthma,None,asthma,402096355.0
individual,himself,7.210434754421146e+17,,2016-04-15 18:32:15,,1.0,,None,"#bigpharma I am in my 60s and LOVE saying 'NONE' when they ask me what medications I'm on. They start early, beware  https://t.co/bCseyQxchi",SpikedLee,Asthma,None,asthma,
individual,himself,7.21070374465704e+17,"/hue-geh/ Blogs & tweets about Finding & creating comfort in everyday life. #hygge #blog #comfort for wellbeing, family, home, interiors, outdoors & travel",2016-04-15 20:19:08,"England, United Kingdom",1.0,,None,@Scanditwitchen going to try that. First attempts sound like I'm having an asthma attack though...,livinghygge,Asthma,None,asthma,4081855647.0
individual,himself,7.210766258870764e+17,alive?,2016-04-15 20:43:59,,1.0,,Pacific Time (US & Canada),Asthma u suck,flrnxadam,Asthma,None,asthma,3502976956.0
individual,himself,7.211175825400218e+17,They Love BriMode. // 12.24.13 // 02.12.16 #LongLiveCeeNZay #OTVStrong,2016-04-15 23:26:44,252,1.0,,Eastern Time (US & Canada),"Dina comes in &amp; say I can't look at Brianna , she gonna give me an asthma attack",briannaanyahh,Asthma,None,asthma,1481620406.0
individual,himself,7.21126809333592e+17,packers fan since '96. stressed out college student. dislikes cheese. lives in cheese state. ||8/29/14 | 7/26/15 | 8/25/15||,2016-04-16 00:03:23,#FeelTheBern,1.0,,Central Time (US & Canada),when he picked that cheesehead up was the moment I needed my inhaler and lost my shit https://t.co/C1EqsarE6F,pinkfloydharry,Asthma,,Inhaler,1228847269.0
individual,himself,7.211413209499771e+17,,2016-04-16 01:01:03,,2.0,,Eastern Time (US & Canada),Almost had an asthma attack playing w them,Trillshaaay,Asthma,None,asthma,567437024.0
individual,himself,7.211821427937894e+17,Mami IG : prettiestgee_,2016-04-16 03:43:16,Dominican Mami in Miami,1.0,,Eastern Time (US & Canada),I feel an asthma attack coming,PrettiestGee_,Asthma,None,asthma,56888249.0
individual,himself,7.21195424321794e+17,"If you relate, then retweet. Be brave, stay strong, and cross the line. We are ran by submissions sent to our tumblr. WARNING TRIGGERING!! Owner:",2016-04-16 04:36:02,,1.0,,Central America,Cross the line if you have asthma.,CrossXTheLine,Asthma,None,asthma,316413258.0
individual,himself,7.212380624249364e+17,#FALF,2016-04-16 07:25:28,,1.0,,None,I have asthma and every time I pick up the dog I get a major cough attack but YOLO,ruizkaaren,Asthma,None,asthma,2575815823.0
individual,himself,7.212398699140874e+17,what is your major malfunction,2016-04-16 07:32:39,,1.0,,Hawaii,@CourtWin ok well um Courtney maybe I should make you an inhaler necklace so you won't idk DIE,Alexa8DaysAWeek,Asthma,,Inhaler,565820365.0
individual,himself,7.213934037669437e+17,Espinosa  | Koury | Selman | Simone | J&J | 5quad | Magcon OG | Damian | Wilk | Luh | Maloley |  Playlist Tomorrow,2016-04-16 17:42:44,florida,1.0,,Pacific Time (US & Canada),It literally hurts to breathe and I DONt want to get up to find my inhaler because I'm already dizzy enough laying down and if I stand up,ClearlyMattt,Asthma,,Inhaler,3313636553.0
individual,himself,7.214989234210652e+17,MSU| Dog lover| #BBN #Reds,2016-04-17 00:42:02,,1.0,,,I hate using an inhaler.,Jstamper10,Asthma,,Inhaler,3104478885.0
