posted_by,talk_about,tweet_id,description,created_at,location,tweets_per_user,sarcasm,timezone,text,screen_name,disease,coordinate,query,user_id
organization,,7.204645523710894e+17,"View all available job listings in Seattle, WA from company sites, job boards and the web at https://t.co/X9YF9QW4pC - thousands of new jobs added daily!",2016-04-14 04:11:49,"Seattle, WA",2.0,,None,"Medical Assistant Asthma Allergy Jobs in Seattle, WA #Seattle #WA #jobs #jobsearch https://t.co/n8zqep6ngW",jobfindlysea,Asthma,None,asthma,4719527682.0
organization,,7.204695099796808e+17,,2016-04-14 04:31:31,,2.0,,None,#Asthma: Overdiagnosis in children sees inhalers dished out like 'fashion ... - https://t.co/7yhlrqtUMm,blundell_judy,Asthma,None,asthma,4635761907.0
organization,,7.204718641963786e+17,Liberty Universty 2018 Bye cincinnati,2016-04-14 04:40:52,,1.0,,,How many puff of your inhaler is to many ??  Mhmm,placidpayton,Asthma,,Inhaler,540173965.0
organization,,7.204726542354964e+17,"Nurses, doctors, social workers, clinics, hospitals, learn how you can help your patients save on their prescription medication.",2016-04-14 04:44:01,,61.0,,Central Time (US & Canada),#asthma Mount Sinai Medical School Teams Up with LifeMap on Asthma Medical App: Apples... https://t.co/r1YvY3lx83 https://t.co/y4mIG8j8DD,DPrescriptio,Asthma,None,asthma,334438369.0
organization,,7.204758505132605e+17,Her Attitude Savage But Her Heart Is Gold $Business Woman$...Lose 5lbs in 5 days!!,2016-04-14 04:56:43,Maryland  Abu Dhabi,1.0,,Central Time (US & Canada),Get Kobe a inhaler real quick,DashLashae,Asthma,,Inhaler,71592844.0
organization,,7.204955194962903e+17,Site: https://t.co/w65LLq23Lf Newsletter: https://t.co/Ob1sQaOoEZ FB: https://t.co/ZlBGxaofF3  Flipboard: https://t.co/23Wk95eSCh,2016-04-14 06:14:52,,28.0,,Pretoria,Exposure to Cockroach Allergens Associated With #Asthma Prevalence  https://t.co/QHst6lJ6Es https://t.co/DmVORaMSq4,AHealthBlog,Asthma,None,asthma,218423826.0
organization,,7.204966703210906e+17,"GP clinic in Mount Gambier, South Australia",2016-04-14 06:19:27,Mount Gambier,1.0,,Adelaide,This week is National Youth Week- Asthma Australia have put together some great information for young people... https://t.co/tmQ4DA7bxK,HawkinsMedical,Asthma,None,asthma,2564849642.0
organization,,7.205039274861978e+17,,2016-04-14 06:48:17,,1.0,,Perth,How exactly does an #asthma attack affect your lungs? This #infographic takes a closer look and offe https://t.co/vrWnSaSNqv,MichaelsChemist,Asthma,None,asthma,3106277654.0
organization,,7.205517785389302e+17,"http://t.co/Z7QmQ9Q0zx is a company that produces interfaces for breathing exercises, breathing games, and breathing entertainment.",2016-04-14 09:58:25,Slovenia,1.0,,Ljubljana,"Breathe out, don't breathe in! #health #breathingexercise #breathe #copd #asthma #emphysema #cysticfibrosis https://t.co/JhKkSGofpw",breathinglabs,Asthma,None,asthma,2839840961.0
organization,,7.205736818275901e+17,Bid at the last second on Ebay FREE,2016-04-14 11:25:28,,6.0,,,"Amazing Herbs 100% Natural Smelling Salts Nasal Inhaler Reduce Mucus &amp; Aller https://t.co/pRGY4iDw7S Ebay Bid Last Second RT, F",MooreYoubidder,Asthma,,Inhaler,
organization,,7.205916384904274e+17,Conversations about Penn State's contributions to society through research. Contact: researcheditor@psu.edu,2016-04-14 12:36:49,Penn State University,1.0,,Eastern Time (US & Canada),.@gizmag #PennStateCollegeofMedicine researchers may have found a way to detect asthma. https://t.co/q0ZNjJ6rx6 https://t.co/0k6jIkqizo,PSUresearch,Asthma,None,asthma,36379245.0
organization,,7.205917252622008e+17,Tweettweet #,2016-04-14 12:37:09,,162.0,,None,asthma_rss: LOW COST ASTHMA INHALERS https://t.co/Ag0KnhMXFy # | https://t.co/O9JAlKxDqh,clinik5,Asthma,None,asthma,3244679472.0
organization,,7.206133428979466e+17,,2016-04-14 14:03:03,,1.0,,Mountain Time (US & Canada),Idling around schools can exacerbate childhood asthma and other respiratory ailments. #ShowUCAIR &amp; keep our kids healthy by being idle free.,UCAIR_UT,Asthma,None,asthma,1488870967.0
organization,,7.206278681292268e+17,bot for @lTACHlUCHIHAS,2016-04-14 15:00:47,,9.0,,London,o yea asthma,ichorbot,Asthma,None,asthma,253260769.0
organization,,7.206326076591596e+17,Every 10 seconds someone has a potentially life-threatening asthma attack. Help us to stop asthma attacks and cure asthma.,2016-04-14 15:19:37,UK,36.0,,London,"RT @AUKCAR: Excited to hear #MyAsthmaStory responses! To take part, make a video, flipagram or complete our survey anonymously  https://t.c...",asthmauk,Asthma,None,asthma,20982609.0
organization,,7.206448061380198e+17,Aerobiology & biomedical contract research. We help companies innovate & differentiate their products & services through claim verification & lab testing.,2016-04-14 16:08:05,"Dublin, Ireland",3.0,,Dublin,Save the date: the Global Initiative for Asthma's #WorldAsthmaDay is coming up on May 3rd https://t.co/yyXYoFZBkl https://t.co/r7vGZ7suo9,AirmidHealth,Asthma,None,asthma,462015173.0
organization,,7.206537449840558e+17,"Writer/artist/photographer/crafter. Jewish feminist. Nonneurotypical. Improv, books, oceans, DIY/thrift, history. #SecondCityFamily #TheBloggessTribe",2016-04-14 16:43:36,prepping to move to Chicago,4.0,,Central Time (US & Canada),"Gray, rainy, chilly day. Tired after night's sleep full of nightmares. Asthma acting up.  Eyeing this afternoon w/trepidation.",WinterLightHome,Asthma,None,asthma,272614288.0
organization,,7.206707470316831e+17,"We are an #online #marketing hub for #healthcare providers - #doctors & #hospitals and #patients. #Medical services #Health at your fingertips, quite literally.",2016-04-14 17:51:10,India,2.0,,Chennai,"When #Air Quality Improves, So Do Kids' #Asthma Symptoms https://t.co/GgBjx4fe7E | #HealthcareMarketing https://t.co/IHDv0aSRE7",Curatiotech,Asthma,None,asthma,843038947.0
organization,,7.206769292007916e+17,98% human | 2% unknown,2016-04-14 18:15:44,NSAZ,1.0,,None,@officialshafeeq + asthma,officialshafeeq,Asthma,None,asthma,2601745404.0
organization,,7.2069537450419e+17,"Just a girl who is passionate about things/people she likes and with an obsessive personality. @EmmaWWE favorited my tweets 3/1/16, 3/8/16, 4/5/16",2016-04-14 19:29:01,Ambrose Asylum,5.0,,Quito,@CourtneyBegiers it's 100$ for the dermatologist and 98 for the inhaler. This is why I don't go to the doctors lmao,CourtneyBegiers,Asthma,,Inhaler,21136354.0
organization,,7.207074764468183e+17,,2016-04-14 20:17:07,Honolulu [b],20.0,,None,#Tips And #Advice For #Managing Your #Asthma https://t.co/RY8gmWm55C,Laurensk18,Asthma,None,asthma,533674260.0
organization,,7.208102125301064e+17,I tweet about various things. I hope everybody will find something intresting there. If you follow me I will follow you!,2016-04-15 03:05:21,,1.0,,Eastern Time (US & Canada),"Asthma diagnosis 'trivialized,' fuels overdiagnosis, doctors say https://t.co/j1u1t6R13o #health",LLinda91,Asthma,None,asthma,1611538375.0
organization,,7.208215397514895e+17,@theencycl9pedia daddy,2016-04-15 03:50:21,,1.0,,,Use an inhaler ypu fool https://t.co/iXyR9wEIcG,DveStrudl,Asthma,,Inhaler,
organization,,7.209170853926298e+17,Breaking news about Asthma.,2016-04-15 10:10:01,San Francisco,44.0,,Pacific Time (US & Canada),Running man Alan kicks asthma into touch to tackle London Marathon https://t.co/iGKzxB14XC,KillAsthma,Asthma,None,asthma,117608112.0
organization,,7.209191988394803e+17,"Active Healthcare is a premier, community-minded provider of medical equipment: CPAP products, respiratory nebulizers & supplies for patients w/ diabetes",2016-04-15 10:18:25,"Raleigh, NC",47.0,,Eastern Time (US & Canada),What Asthmatics Should Know about Ozone Forecast Season https://t.co/9tlug7Gv0l #Asthma #BreatheEZ,ActivHealthcare,Asthma,None,asthma,418406425.0
organization,,7.209210319349187e+17,Nat: Sci-fi fan; transgender & neurodiversity blogger; IT professional; sings & draws stuff http://t.co/15u4NrWsr2 http://t.co/gJ0aI9hLNx http://t.co/Pzreosm6Vj,2016-04-15 10:25:42,"Nottingham, UK",2.0,,London,"Got confirmation the new preventer inhaler is working really well, got more prescribed, my repeat prescription increased and review extended",quarridors,Asthma,,Inhaler,14401382.0
organization,,7.209213002109583e+17,,2016-04-15 10:26:46,,5.0,,None,"Final symposium ASTROLAB-project.eu: adherence to asthma meds predicts control and SABA use, but not exacerbations (longitudinal data)",DeMarijndebruin,Asthma,None,asthma,3426690466.0
organization,,7.209322153291366e+17,RSS feed for #asthma papers in #Pubmed. Create a feed of your own using instructions here:,2016-04-15 11:10:09,,143.0,,None,Ethnic differences in asthma treatment among Swedish adolescents: A multilevel analysis of individual heterogeneity. https://t.co/HYQVcxPr4x,asthma_papers,Asthma,None,asthma,2366030767.0
organization,,7.209328767584911e+17,,2016-04-15 11:12:46,"Pittsburgh, PA",1.0,,None,"This Plant Can Cure Asthma, Diabetes, High Cholesterol and Kidney Diseases https://t.co/NW8Ejkx7My",RoseMPepper,Asthma,None,asthma,470588632.0
organization,,7.209446080630415e+17,Multifandom. Baby.Inspirit.Starlight.Boice.Carat.MooMoo.Lovelinus.Star1.Eel.SangsterGangster.MRJER.GalwayGirl.,2016-04-15 11:59:23,Mato Planet,1.0,,None,Sleeplessness + Skin Asthma + Diarrhea + Cough = ...,eine_marie,Asthma,None,asthma,778256160.0
organization,,7.20951803530068e+17,"Fellowship activities in the Division of Pulmonary, Allergy, and Critical Care Medicine at the University of Pittsburgh and UPMC.",2016-04-15 12:27:59,"Pittsburgh, PA",10.0,,None,"Asthma rx - ICS potent anti-inflam and agent of choice for persistent asthmatics, one of the only meds likely to dec asthma deaths #coreconf",PACCM_fellows,Asthma,None,asthma,
organization,,7.209565443183534e+17,"Best Prices for Child Care Items: Find Online Deals, Latest Offers  and Killer Discounts!",2016-04-15 12:46:49,,1.0,,,AsmaPlan Plus Peak Flow Meter https://t.co/7FMXGFu8Xy #child #children https://t.co/9uAH0vK8oe,scolenke86,Asthma,,Peak Flow Meter,4258437441.0
organization,,7.20964905101357e+17,Bringing up up to date with the latest information about Allergy relief. We find interesting news and events for Allergy Sufferers,2016-04-15 13:20:02,,60.0,,None,The quality of the air you breathe directly affects the state of your health https://t.co/0EzPgtLdWj  #Asthma,AllergyNewsUSA,Asthma,None,asthma,1869363738.0
organization,,7.209690497404764e+17,"A free resource for Vernon and area - Local news, free classifieds and business directory, real estate listings, and daily job postings.",2016-04-15 13:36:31,"Vernon, BC",1.0,,None,"Asthma diagnosis 'has been trivialized,' doctors say - https://t.co/QGZQKTPL5T #VernonNews https://t.co/gYjE8nK0lu",VernonBCNews,Asthma,None,asthma,1255271270.0
organization,,7.209791043386778e+17,"to Play, Perform, & Have Fun! The Leader n Recreation, Motivation, & Inspiration Worldwide! What Do U Play, Where Do U Perform, & How Do U Have Fun?",2016-04-15 14:16:28,Planet Earth,1.0,,Eastern Time (US & Canada),https://t.co/nAR45sd7lf Asthma medicine approval is a local success story - Philadelphia Business Journal https://t.co/y9godguDLf,ThePowerOfUdot,Asthma,None,asthma,104205037.0
organization,,7.209816038964019e+17,"Real is a nationally recognized soccer club filled with fun, winning, goals, and celebrations in a sport made for creating great memories of today & tomorrow!",2016-04-15 14:26:24,Highlands Ranch,1.0,,Mountain Time (US & Canada),"Senior Banquet, Summer Camps, Asthma and more https://t.co/KIt1FKIz3V",RealColoSoccer,Asthma,None,asthma,67075914.0
organization,,7.209825307619533e+17,,2016-04-15 14:30:05,,1.0,,None,On the Healthy Homes Des Moines bus tour!  Providing services to Des Moines families with children who have asthma.@HealthyHomesDSM,mcordaro4,Asthma,None,asthma,549588108.0
organization,,7.209861343067791e+17,jag foljer med dig hem ikvall for jag vill inte vara sjalv @la_croixlty @thebigtitty,2016-04-15 14:44:24,,2.0,,Eastern Time (US & Canada),"sick holy trinity: flonase, carmex, inhaler",peachnectarine,Asthma,,Inhaler,2822281770.0
organization,,7.20998582510338e+17,"Current affairs & talk by Canadians, for Canadians.  #SiriusXM channel 167  1-855-958-TALK. https://t.co/ELBdUfb3cR https://t.co/4J0lHW7G9A",2016-04-15 15:33:52,Toronto,2.0,,Eastern Time (US & Canada),"Childhood asthma overdiagnosed, argue leading respiratory doctors and @DrDinaKulik weighs in LIVE @WhatSheSaid167",SXMCanadaTalks,Asthma,None,asthma,1343036322.0
organization,,7.210135646690836e+17,Kind heart. Fierce mind. Brave spirit.,2016-04-15 16:33:24,Philippines,1.0,,Hong Kong,@POKPOKNICALUM @Robvilla_ and Robert Rene Villanueva's mouth is your inhaler.,bellledeleon,Asthma,,Inhaler,580822374.0
organization,,7.210222795769856e+17,Success| money | ambition | god | staying true | family | getting to the finer things in life |VivaPaneche | GOPATRIOTS,2016-04-15 17:08:02,VibeCity,1.0,,Pacific Time (US & Canada),U got an inhaler? Cuz I heard you got that Ass-Ma haha,VivaLaVidaGBC,Asthma,,Inhaler,412396959.0
organization,,7.210336831178015e+17,,2016-04-15 17:53:20,"Fresno, CA",2.0,,None,"Bully Mendacity preaching his message of hate on KMJ right now. Still doesn't get it. Oh, #Fresno #asthma # water  https://t.co/ChqrNd0SAq",airfrezno,Asthma,None,asthma,2367881335.0
organization,,7.210357128843059e+17,The social career resource for nurses. Tweeting daily nursing and health news. #TeamNurses,2016-04-15 18:01:24,,1.0,,Central Time (US & Canada),Why You Cant Always Count On Pollen Counts #Health #Allergy #Asthma https://t.co/k0ULWhtvsf,NurseGroups,Asthma,None,asthma,64031011.0
organization,,7.210499340201452e+17,"You! Drugmart is a neighbourhood pharmacy in the Elmwood community of Winnipeg, Manitoba, Canada. Visit us at 359 Johnson Ave W Unit E or phone 204-654-9499.",2016-04-15 18:57:55,"Winnipeg, MB",1.0,,Central Time (US & Canada),"About a third of people diagnosed with asthma may not actually have it, specialist says.  https://t.co/xns1FplWGH",YouDrugmart,Asthma,None,asthma,2578944031.0
organization,,7.210519262767636e+17,"Health & Safety, First Aid, Resus/BLS, AED, Anaphylaxis & Fire Safety training, consultancy & documentation across UK. Specialise in supporting GP Practices",2016-04-15 19:05:50,"Weymouth, Dorset, UK",2.0,,London,"Schools - Have you students with life threatening illnesses, asthma, diabetes or anaphylaxis? We can help https://t.co/6XzuEibDBw",Sirius_Training,Asthma,None,asthma,194096198.0
organization,,7.210522513479066e+17,Natural Approach To Curing Asthma,2016-04-15 19:07:07,London,105.0,,Kyiv,"Some people with #asthma rarely experience symptoms, usually in response to triggers, whereas others may have marked and persistent symptoms",NoMoreAsthma,Asthma,None,asthma,2466687799.0
organization,,7.210580325752013e+17,,2016-04-15 19:30:06,,4.0,,None,Digital Asthma Monitor recommended by the Asthma Society of Canada  https://t.co/73GrWbnYkz https://t.co/yQI5OoNVOO,bidawesomedeals,Asthma,None,asthma,4909861245.0
organization,,7.210757816909947e+17,,2016-04-15 20:40:37,Canada,3.0,,Arizona,"New post: Asthma diagnosis has been trivialized, doctors say https://t.co/cWJ1JoXDhX https://t.co/wb2ZF8ZWjc",journallnews,Asthma,None,asthma,76303.0
organization,,7.210959677018685e+17,"Easy to understand, relevant, shareable health news. Newsletter https://t.co/SADLHfAGAj",2016-04-15 22:00:50,United States,9.0,,Central Time (US & Canada),Preventing children from developing #asthma during the pregnancy https://t.co/qeZYy1xgsZ https://t.co/jmPui7arjN,dailyRx,Asthma,None,asthma,197185320.0
organization,,7.211096346653123e+17,,2016-04-15 22:55:09,"London, UK",1.0,,London,Homeopathy Doesnt Work for Asthma.: https://t.co/VADTwJFrGx #homeopathy #WHAW2016 #HAW2016 https://t.co/tAuxUAjLUq,zeno001,Asthma,None,asthma,61177115.0
organization,,7.211108371428844e+17,,2016-04-15 22:59:55,,1.0,,Eastern Time (US & Canada),#SickJustGotReal and Pfizer Consumer Healthcare can help! Enter 2 #win a  $25 Visa GC  #AMomCanDream @kristiannm  https://t.co/0R253B6jn7,mummytotwoboys1,Asthma,None,asthma,284817629.0
organization,,7.211934472150139e+17,"With over 30 years experience, I am an expert at saving teeth, bone, implants and gum structure. You can hear me 9am Friday's on Westchester's 1460AM WVOX!",2016-04-16 04:28:11,"Briarcliff Manor, NY",1.0,,Eastern Time (US & Canada),"Exploring the Link Between Oral Health, Asthma, Allergies &amp; Eczema | Yourwellness https://t.co/5QsJrTULHb",DrSaveMyTeeth,Asthma,None,asthma,347881612.0
organization,,7.211954886330737e+17,All things happening in the wonderful world of top news. Want to advertise with us? Contact us at yourtwitterusers@gmail.com,2016-04-16 04:36:18,The Internet,4.0,,Pacific Time (US & Canada),Asthma could be cured within 5 years after drug breakthrough via /r/worldnews @ihatetech... https://t.co/5gOl6nXjzb https://t.co/zUuS7DSpEU,2016dailynews,Asthma,None,asthma,4323364763.0
organization,,7.212386669333135e+17,"The entrepreneur always searches for change, responds to it, and exploits it as an opportunity.",2016-04-16 07:27:52,"North Dakota, USA",1.0,,None,Will an Air Purifier Cure Asthma or Allergies? https://t.co/wsAQnWAY8E,GothartBowie,Asthma,None,asthma,
organization,,7.213516751563776e+17,"Urgent Care & Family Health Center In Carlsbad, CA",2016-04-16 14:56:56,,1.0,,,"Amazing innovations in the medical field today. For the best medical attention, come to Urgent Care3D! #UrgentCare3D https://t.co/sYRbHGgrx0",UrgentCare3D,Asthma,,Inhaler,
organization,,7.213755245185229e+17,,2016-04-16 16:31:42,,2.0,,,Connect'inh by Kappa Sante is a smart medtech device that tracks when and where asthmatics use .. https://t.co/ayA1fZnyF1 #Disrupt,disruptideas1,Asthma,,Inhaler,4243662136.0
organization,,7.214143414808371e+17,"I'm a 30 something & I like Sci Fi, Horror, Fantasy, Drama & Comedy basically anything.",2016-04-16 19:05:56,Unicorn Island in NCL,2.0,,London,#LetMeEntertainYouBy taking a puff on my inhaler/lung sucker https://t.co/3Fn08qlUjK,SugarGretel,Asthma,,Inhaler,2499347767.0
organization,,7.214865685324022e+17,poorly tweeted from boring locations.,2016-04-16 23:52:57,Greenwood Lake,2.0,,Atlantic Time (Canada),@rosafortuna_ Urgent care use to take everyone all the time same thing happened to me last time I went... To get my inhaler refilled.,totescolin,Asthma,,Inhaler,198009457.0
organization,,7.215323306411991e+17,,2016-04-17 02:54:47,,221.0,,Kuwait,Is them noticeable that high nebulizer literally be found fda sealed previous to yourselves have subconscious s...,BaileyDerrick2,Asthma,None,Nebulizer,1240746872.0
organization,,7.215402685293527e+17,whs guard abstinent!! Cam,2016-04-17 03:26:20,"Houston, TX",1.0,,,Tyler know he need that inhaler right about now https://t.co/yrsNecOGeC,liljordyyy,Asthma,,Inhaler,3345028990.0
organization,,7.215935520403866e+17,"no officer, there isn't any blood in my alcohol system.",2016-04-17 06:58:04,,1.0,,,"Lost $75, my phone, inhaler, Chapstick, and my dignity BUUUTT got into the beer gardens and got free drinks every 5 minutes SO coacHELLYAASS",victoriaavl,Asthma,,Inhaler,2421524916.0
organization,,7.217059005918822e+17,"@tittiesnamjoon: i dont think u understand ,, mila + hoseok = art",2016-04-17 14:24:30,#jihopeambassador #thighgangTM,1.0,,Central Time (US & Canada),RT @Armin_is_da_bae: I NEED MY INHALER RN OH MY LORD https://t.co/ZuoQxPndLj,hoseokjng,Asthma,,Inhaler,1317289826.0
organization,,7.217987587662807e+17,"The only easy day was yesterday. What we do for ourselves dies with us. What we do for others, remains & is immortal.",2016-04-17 20:33:29,,1.0,,Pacific Time (US & Canada),*hits inhaler  *sparks big right after,CaydenWhitten34,Asthma,,Inhaler,708245059.0
organization,,7.218165093041725e+17,Pharmacist,2016-04-17 21:44:01,"Los Angeles, CA",14.0,,,Ventolin inhaler coupons. Order Ventolin at https://t.co/rvHIQzMawO Reliable Internet Pharmacy! Coupons Inside!,frankevans111,Asthma,,Inhaler,3124559271.0
organization,,7.218963783355146e+17,,2016-04-18 03:01:23,,212.0,,Istanbul,Is themselves conspicuous that straight a nebulizer in actuality stand fda scriptural ere jivatma impulse buyin...,LarkinsGregory,Asthma,None,Nebulizer,1240572565.0
organization,,7.22172094126125e+17,Simply collecting IG posts tagged #weedofIG and #nobunkjustfunk  Pics not mine and I'm not responsible for content posted  Don't buy drugs from anyone online!,2016-04-18 21:16:59,,2.0,,,https://t.co/1OunOdv7zn by misunderstood_inhaler__uk https://t.co/27SfFFjzdx,WEEDOFIG,Asthma,,Inhaler,3138397501.0
organization,,7.22247230300799e+17,oprah's mentioned me twice and honestly that's my crowning achievement in life. hi mom!,2016-04-19 02:15:33,not in ya girls dms dont worry,6.0,,Eastern Time (US & Canada),@RealPaigeWWE did you find the inhaler or nah? #assma,OprahsHubby,Asthma,,Inhaler,377691921.0
organization,,7.222476192636682e+17,//Character account! Literate crack/serious rp! // Genderfluid/Crossdresser. They/he pronouns. Boyfriend is @HopesAndMemes_ M!A: Tiny Bunny,2016-04-19 02:17:05,avi by moonbunnyz on tumblr,1.0,,,"@HopesAndMemes_ *starts trying to calm his breathing down, getting enough air to get out his inhaler and correctly use it*",shslchihirochan,Asthma,,Inhaler,
organization,,7.224135487653601e+17,"Confident and knowledgeable in nebulisers, baby steps with Twitter",2016-04-19 13:16:26,,13.0,,None,Contact us if you if you need help with a nebulizer #lunghealth https://t.co/7iS9gyN3Qp https://t.co/1gpPmP8EUC,dggreen,Asthma,None,Nebulizer,19527401.0
organization,,7.224466451582607e+17,MULTI-FANDOM || BIGBANG || 2NE1 || SUJU || SNSD || WINNER || iKON || AKMU || GOT7 || VIXX || BTS || ZION T.,2016-04-19 15:27:57,Philippines,1.0,,Seoul,INHALER PLEASE! https://t.co/XuZDiXF9RD,joreenmaexiii,Asthma,,Inhaler,2197942225.0
organization,,7.225022929439334e+17,,2016-04-19 19:09:04,,221.0,,Kuwait,Is number one arrogant that la nebulizer de facto live fda applauded erst myself impulse buying the very model?: jCAtr,BaileyDerrick2,Asthma,None,Nebulizer,1240746872.0
organization,,7.225899401109996e+17,"Track the latest #ClinicalApprovals news, research, clinical trials, companies and reports. Continuously updated from 500+ news, research publications.",2016-04-20 00:57:21,London,1.0,,,#clinicalapprovals : Metered Dose Inhaler Devices Medical Devices Pipeline Assessment 2016 https://t.co/dAfPf7raTr,ClinicalApprova,Asthma,,Inhaler,348359520.0
organization,,7.226038149398323e+17,,2016-04-20 01:52:29,,218.0,,Adelaide,3 myths plus ou moins la nebulizer motif now afterlife treatment: urJQ,LambertsOswald,Asthma,None,Nebulizer,1240747934.0
organization,,7.227499826133115e+17,give me love,2016-04-20 11:33:18,LDN,1.0,,London,i need my inhaler so bad I can't fucking breathe,RUINEDSEB,Asthma,,Inhaler,2741763729.0
organization,,7.228151349393654e+17,"freeman enthusiast, pizza lover & real-life hobbit",2016-04-20 15:52:12,hufflepuff | setlock,1.0,,London,WHERE IS MY BLOODY INHALER https://t.co/0YBOBZg48P,MARTlNJCFREEMAN,Asthma,,Inhaler,2734185568.0
organization,,7.22823161054634e+17,,2016-04-20 16:24:05,,1.0,,None,Thought this rang a bell; IL 33 has been implicated in allergic asthma. https://t.co/qlkeRztIvg,RexannaKeats,Asthma,None,Allergic Asthma,2474709524.0
organization,,7.229565187406356e+17,"Christian. PCOS. Texan. Happily Married. Proud Mommy. Adventurer. I: Travel, Cooking, Hiking, Fitness, Coffee, Food, Fandom.",2016-04-21 01:14:00,"Holland, MI",1.0,,Central Time (US & Canada),Made it to the top of Mt. Pisgah with a monkey on my back and no inhaler. Cheers to many more... https://t.co/3fm4r8PTdY,Chachzilla5000,Asthma,"-86.20394286,42.7774141",Inhaler,182064427.0
organization,,7.230363242409738e+17,Interstitial Lung Disease CNS @Leic_hospital with a passion for #PulmonaryRehab | Member of #BTSNurses & @ARNS_UK | MSc #Leadership | Yogi | Bookworm | Cyclist.,2016-04-21 06:31:07,"Leicestershire, UK",9.0,,London,Checking our patient's inhaler technique is still important. #COPD #RespEd @ARNS_UK  https://t.co/lGvA8gdVWi,ILD_Rehab,Asthma,,Inhaler,1145515010.0
organization,,7.230509872298312e+17,,2016-04-21 07:29:23,,212.0,,Istanbul,Is ego ex officio that an nebulizer verily exist fda in good odor yet ruach nod not an illusion?: VYkg,LarkinsGregory,Asthma,None,Nebulizer,1240572565.0
organization,,7.231291524135322e+17,Family Doctor special interest in respiratory disease. Wildlife photographer. Clinical Lead National Review of Asthma Death (NRAD) 2011-2014.,2016-04-21 12:39:59,Uk,4.0,,,#nature #npjPCRM #inhaler beliefs by expert group @ARNS_UK @ADMIT_inhale @asthmauk   @JaneScullion @HealthyLDN See https://t.co/WByfQrvAyJ,bigcatdoc,Asthma,,Inhaler,259914385.0
organization,,7.23275174171304e+17,"Aromatherapy and essential oil education, certification and resources for beginners and professionals!",2016-04-21 22:20:13,Everywhere,5.0,,Central Time (US & Canada),"What is an #aromatherapy inhaler, and what can I use it for? https://t.co/ToskUYYq0X #essentialoils #health #wellness #happy",aromahead,Asthma,,Inhaler,18515272.0
organization,,7.233261676509635e+17,"No excessive use of caps, linking, spamming, banned words allowed (everyone) (warning) *twerks*",2016-04-22 01:42:51,in a chat and in rehab,22.0,,,Hey homegirl! do yo have an inhaler? Cause yo got dat ass ma'am!,LadyMoobot,Asthma,,Inhaler,1893266868.0
organization,,7.233572693462753e+17,SC  BB.,2016-04-22 03:46:26,MD,1.0,,Eastern Time (US & Canada),allergies &amp; asthma is a baaaaad combo,Tjtyree01,Asthma,None,asthma,569241950.0
organization,,7.233861515081441e+17,,2016-04-22 05:41:13,,8.0,,None,"Dust Mite Droppings The Key Redient In New Asthma Pill ... : https://t.co/nxTHKdRtHz , https://t.co/YDZ6bM8rS8",BINGBINGBLOG,Asthma,None,asthma,3118545527.0
